# name: test/verify_delta_tblproperties.test
# description: Generic Delta table-property functions (fabricator_delta_tblproperties / _set_tblproperties) +
#              honoring delta.isolationLevel per-table (the TABLE property overrides the catalog default).
# group: [fabricator]

require fabricator

require parquet

require-env FABRICATOR_DELTA_WRITE_DIR

# ---- Slice 1: SET / READ / UNSET round-trip (metaData commit; kernel-valid) ----

statement ok
ATTACH '${FABRICATOR_DELTA_WRITE_DIR}/tp' AS lake (TYPE fabricator, PROVIDER 'delta', deletion_vectors false, column_mapping 'none');

statement ok
CREATE TABLE lake.main.t AS SELECT i AS id FROM range(3) t(i);

# a fresh plain table has no delta.* properties
query I
SELECT count(*) FROM fabricator_delta_tblproperties('lake', 'main.t');
----
0

# SET two properties -> one metaData commit; the applied rows are echoed
query TT
SELECT property, value FROM fabricator_delta_set_tblproperties('lake', 'main.t', '{"delta.isolationLevel":"Serializable","custom.owner":"cm"}') ORDER BY 1;
----
custom.owner	cm
delta.isolationLevel	Serializable

# read back
query TT
SELECT property, value FROM fabricator_delta_tblproperties('lake', 'main.t') ORDER BY 1;
----
custom.owner	cm
delta.isolationLevel	Serializable

# UNSET (null value) removes the key
statement ok
SELECT * FROM fabricator_delta_set_tblproperties('lake', 'main.t', '{"custom.owner":null}');

query T
SELECT value FROM fabricator_delta_tblproperties('lake', 'main.t') WHERE property = 'delta.isolationLevel';
----
Serializable

query I
SELECT count(*) FROM fabricator_delta_tblproperties('lake', 'main.t') WHERE property = 'custom.owner';
----
0

# feature-enabling keys are rejected (need a protocol upgrade at CREATE)
statement error
SELECT * FROM fabricator_delta_set_tblproperties('lake', 'main.t', '{"delta.enableChangeDataFeed":"true"}');
----
enables a table FEATURE

# survives re-attach (it's a real metaData commit)
statement ok
DETACH lake;

statement ok
ATTACH '${FABRICATOR_DELTA_WRITE_DIR}/tp' AS lake2 (TYPE fabricator, PROVIDER 'delta');

query T
SELECT value FROM fabricator_delta_tblproperties('lake2', 'main.t') WHERE property = 'delta.isolationLevel';
----
Serializable

statement ok
DETACH lake2;

# ---- Slice 2: the TABLE's delta.isolationLevel OVERRIDES the catalog default ----
# With the table property = Serializable, a concurrent blind append matching the transaction's read
# predicate is a REAL conflict — proving our writer honors the TABLE property, not the catalog-wide level.

# This slice proves the TABLE property overrides the CATALOG default, so the catalog must be the level the
# property is NOT: explicitly write_serializable (the catalog default became 'serializable' on 2026-08-01).
statement ok
ATTACH '${FABRICATOR_DELTA_WRITE_DIR}/iso' AS db (TYPE fabricator, PROVIDER 'delta', isolation_level 'write_serializable');

statement ok
CREATE TABLE db.main.t AS SELECT i AS id, 'x' AS name FROM range(10) t(i);

# make the table Serializable via the generic setter (the catalog stays write_serializable default)
statement ok
SELECT * FROM fabricator_delta_set_tblproperties('db', 'main.t', '{"delta.isolationLevel":"Serializable"}');

statement ok con1
BEGIN;

# the DELETE's scan records read predicate id = 1
statement ok con1
DELETE FROM db.main.t WHERE id = 1;

# a concurrent blind append MATCHING that predicate (autocommit on the same path)
statement ok con2
INSERT INTO db.main.t VALUES (1, 'dup');

# under Serializable (the TABLE property, overriding the write_serializable catalog default) this CONFLICTS
statement error con1
COMMIT;
----
transaction conflict

# con1 rolled back; the concurrent duplicate landed
query I
SELECT count(*) FROM db.main.t WHERE id = 1;
----
2

# Now UNSET the property -> the table falls back to the catalog default (write_serializable): the same
# matching concurrent append COMMUTES (the commit rebases on top of it), no conflict.
statement ok
SELECT * FROM fabricator_delta_set_tblproperties('db', 'main.t', '{"delta.isolationLevel":null}');

statement ok con1
BEGIN;

statement ok con1
DELETE FROM db.main.t WHERE id = 3;

statement ok con2
INSERT INTO db.main.t VALUES (3, 'dup2');

# write_serializable: commutes -> COMMIT succeeds. con1's DELETE of the original id=3 applies AND con2's
# appended (3,'dup2') is kept -> exactly one id=3 row remains (the dup), proving the commit landed.
statement ok con1
COMMIT;

query I
SELECT count(*) FROM db.main.t WHERE id = 3;
----
1

statement ok
DETACH db;

# ---- CREATE never stamps delta.isolationLevel automatically (changed 2026-08-01) ----
# A CREATE used to bake the catalog's ATTACH isolation_level into the table. That conflated a per-catalog
# BEHAVIOUR knob with a durable per-table DECLARATION, and because the property WINS over any catalog
# (slice 2 above), the stamp made an attach-time choice permanent AND silently overrode a different
# catalog's explicit setting on the same table later — which is precisely the composition slice 2 and
# verify_delta_row_level_concurrency §6 depend on. Neither level stamps now; declaring a level is an
# explicit, per-table act (WITH (...) at CREATE, or fabricator_delta_set_tblproperties).
# docs/delta-transactions.md §10.6a.

# the DEFAULT catalog (serializable) stamps NOTHING
statement ok
ATTACH '${FABRICATOR_DELTA_WRITE_DIR}/serc' AS sc (TYPE fabricator, PROVIDER 'delta');

statement ok
CREATE TABLE sc.main.t AS SELECT i AS id FROM range(3) t(i);

query I
SELECT count(*) FROM fabricator_delta_tblproperties('sc', 'main.t') WHERE property = 'delta.isolationLevel';
----
0

statement ok
DETACH sc;

# and NEITHER does an explicit write_serializable catalog — the ATTACH option stays a catalog behaviour
statement ok
ATTACH '${FABRICATOR_DELTA_WRITE_DIR}/defc' AS dc (TYPE fabricator, PROVIDER 'delta', isolation_level 'write_serializable');

statement ok
CREATE TABLE dc.main.t AS SELECT i AS id FROM range(3) t(i);

query I
SELECT count(*) FROM fabricator_delta_tblproperties('dc', 'main.t') WHERE property = 'delta.isolationLevel';
----
0

# declaring it is EXPLICIT, and lands in commit-0 of that table (per-table, opt-in). This is the spelling
# to use when another engine must honor the weaker level: Fabric Spark REFUSES to set WriteSerializable via
# its own DDL but HONORS it when it is already on the table (both measured 2026-07-31).
statement ok
CREATE TABLE dc.main.ws WITH ("delta.isolationLevel"='WriteSerializable') AS SELECT 1 AS id;

query T
SELECT value FROM fabricator_delta_tblproperties('dc', 'main.ws') WHERE property = 'delta.isolationLevel';
----
WriteSerializable

query I
SELECT count(*) FROM read_text('${FABRICATOR_DELTA_WRITE_DIR}/defc/ws/_delta_log/00000000000000000000.json')
WHERE content LIKE '%WriteSerializable%';
----
1

statement ok
DETACH dc;

# ---- The CATALOG DEFAULT is write_serializable (restored 2026-08-11; was serializable 2026-08-01..08-11) ----
# Pinned directly, because everything above states its level EXPLICITLY — without this, a regression in the
# default would not fail any test. The shape is slice 2's, minus the property and minus the ATTACH option: a
# concurrent blind append MATCHING the transaction's read predicate. Under write_serializable it COMMITS
# (a blind append is exempt from the reader's predicate check); under serializable it conflicts.
#
# ⚠ THREE LEGS, EACH THE OTHERS' CONTROL, and the first is worthless alone. "The commit succeeded" would pass
# equally if conflict detection had stopped working entirely, or if the transaction had never recorded a read
# — so the STRICTER legs have to be here, and they have to reach strictness by the two different routes that
# outrank a catalog default: the per-table PROPERTY (§b) and the ATTACH OPTION (§c).

statement ok
ATTACH '${FABRICATOR_DELTA_WRITE_DIR}/defiso' AS dflt (TYPE fabricator, PROVIDER 'delta');

statement ok
CREATE TABLE dflt.main.t AS SELECT i AS id, 'x' AS name FROM range(10) t(i);

# No property was stamped — not by the default and not by anything else — so the level really does come from
# the catalog default. This is also the assertion that pins "a CREATE never bakes the catalog's level in".
query I
SELECT count(*) FROM fabricator_delta_tblproperties('dflt', 'main.t') WHERE property = 'delta.isolationLevel';
----
0

# §a — THE DEFAULT: the blind append is exempt, so the transaction commits.
statement ok con1
BEGIN;

statement ok con1
DELETE FROM dflt.main.t WHERE id = 1;

statement ok con2
INSERT INTO dflt.main.t VALUES (1, 'dup');

statement ok con1
COMMIT;

# §b — the STRICTER level is reachable per-table and OVERRIDES the catalog default. This is the direction
# that matters for cross-engine work: Fabric Spark commits at Serializable and its DDL cannot set
# WriteSerializable, so a table shared with it wants this property rather than an ATTACH option.
statement ok
SELECT * FROM fabricator_delta_set_tblproperties('dflt', 'main.t', '{"delta.isolationLevel":"Serializable"}');

statement ok con1
BEGIN;

statement ok con1
DELETE FROM dflt.main.t WHERE id = 3;

statement ok con2
INSERT INTO dflt.main.t VALUES (3, 'dup2');

statement error con1
COMMIT;
----
transaction conflict

statement ok
DETACH dflt;

# §c — the ATTACH OPTION reaches the same strictness on a table that declares NOTHING, which is what
# separates "the property was read" from "the option was read". Its own root, so no property can leak in.
statement ok
ATTACH '${FABRICATOR_DELTA_WRITE_DIR}/defiso_s' AS strict (TYPE fabricator, PROVIDER 'delta', isolation_level 'serializable');

statement ok
CREATE TABLE strict.main.t AS SELECT i AS id, 'x' AS name FROM range(10) t(i);

query I
SELECT count(*) FROM fabricator_delta_tblproperties('strict', 'main.t') WHERE property = 'delta.isolationLevel';
----
0

statement ok con1
BEGIN;

statement ok con1
DELETE FROM strict.main.t WHERE id = 5;

statement ok con2
INSERT INTO strict.main.t VALUES (5, 'dup3');

statement error con1
COMMIT;
----
transaction conflict

statement ok
DETACH strict;

# ============================================================================
# delta.checkpointInterval is HONOURED, not merely stored
# ============================================================================
#
# The property was in the canonical WITH list — accepted, written into the table config, and read by
# nobody: engineered-wood took its interval from a code-level option only, so a table declaring 25 was
# still checkpointed every 10. Storing a declaration and then honouring it incorrectly is worse than not
# accepting it, because another engine reads that config and believes it.
#
# ⚠ THE CONTROL IS THE LOAD-BEARING HALF. Asserting only "the declaring table has no checkpoint at v10"
# passes equally if checkpointing had simply stopped working. The two tables take the SAME statements and
# differ ONLY in the property.
#
# ⚠ Each INSERT must be its own statement: one bulk INSERT is ONE commit, so a `range(2, 27)` version of
# this reaches v2 and neither interval fires — the section then passes for the wrong reason.

statement ok
ATTACH '${FABRICATOR_DELTA_WRITE_DIR}/ckint' AS ck (TYPE fabricator, PROVIDER 'delta');

statement ok
CREATE TABLE ck.main.declared WITH ("delta.checkpointInterval" = '25') AS SELECT 1 AS id;

statement ok
CREATE TABLE ck.main.plain AS SELECT 1 AS id;

# The declaration really is on the table (not silently dropped at CREATE).
query I
SELECT count(*) FROM fabricator_delta_tblproperties('ck', 'main.declared')
WHERE property = 'delta.checkpointInterval' AND value = '25';
----
1

# CREATE AS SELECT is v0 + v1, so eight more commits each lands both tables on v9...

statement ok
INSERT INTO ck.main.declared VALUES (2);

statement ok
INSERT INTO ck.main.plain VALUES (2);

statement ok
INSERT INTO ck.main.declared VALUES (3);

statement ok
INSERT INTO ck.main.plain VALUES (3);

statement ok
INSERT INTO ck.main.declared VALUES (4);

statement ok
INSERT INTO ck.main.plain VALUES (4);

statement ok
INSERT INTO ck.main.declared VALUES (5);

statement ok
INSERT INTO ck.main.plain VALUES (5);

statement ok
INSERT INTO ck.main.declared VALUES (6);

statement ok
INSERT INTO ck.main.plain VALUES (6);

statement ok
INSERT INTO ck.main.declared VALUES (7);

statement ok
INSERT INTO ck.main.plain VALUES (7);

statement ok
INSERT INTO ck.main.declared VALUES (8);

statement ok
INSERT INTO ck.main.plain VALUES (8);

statement ok
INSERT INTO ck.main.declared VALUES (9);

statement ok
INSERT INTO ck.main.plain VALUES (9);

# ...and the ninth crosses v10, the DEFAULT interval.
statement ok
INSERT INTO ck.main.declared VALUES (10);

statement ok
INSERT INTO ck.main.plain VALUES (10);

# CONTROL: the default interval fired, so checkpointing works and the table below is not merely broken.
query I
SELECT count(*) FROM glob('${FABRICATOR_DELTA_WRITE_DIR}/ckint/plain/_delta_log/*.checkpoint.parquet');
----
1

# THE ASSERTION: the declared interval (25) is respected, so v10 produced NOTHING.
query I
SELECT count(*) FROM glob('${FABRICATOR_DELTA_WRITE_DIR}/ckint/declared/_delta_log/*.checkpoint.parquet');
----
0

query I
SELECT count(*) FROM ck.main.declared;
----
10

statement ok
DETACH ck;

# ============================================================================
# delta.logRetentionDuration — cleanup NEVER touches a commit inside the window
# ============================================================================
#
# Log cleanup deletes commit files a checkpoint has made redundant. This section pins the DANGEROUS
# direction — that a recent commit is never collected — because that is the assertion a CI tier can make
# deterministically. The positive (files past the horizon really are collected) is timing-dependent and
# lives in engineered-wood's LogCleanupTests, which injects a clock instead of sleeping; it is also
# verified end to end by hand.
#
# ⚠ WHY THIS IS WORTH A GATE. Our host filesystem reported a HARDCODED Unix epoch as every file's
# modification time until 2026-08-08 — nothing read it, so nothing noticed. Under that value every commit
# looks 56 years old, so a 30-day retention would collect a commit written one second ago. If the fake ever
# returns, or the timestamp plumbing regresses to a constant, this section fails: the table below keeps
# every commit only because their real ages are minutes.

statement ok
ATTACH '${FABRICATOR_DELTA_WRITE_DIR}/logret' AS lr (TYPE fabricator, PROVIDER 'delta');

# checkpointInterval 2 so several checkpoints land — each one is a cleanup opportunity.
statement ok
CREATE TABLE lr.main.t WITH ("delta.checkpointInterval" = '2') AS SELECT 1 AS id;

statement ok
INSERT INTO lr.main.t VALUES (2);

statement ok
INSERT INTO lr.main.t VALUES (3);

statement ok
INSERT INTO lr.main.t VALUES (4);

statement ok
INSERT INTO lr.main.t VALUES (5);

# POSITIVE CONTROL: checkpoints really were written, so cleanup had something to act on and the assertion
# below is about RETENTION rather than about cleanup never having been reachable.
query I
SELECT count(*) > 0 FROM glob('${FABRICATOR_DELTA_WRITE_DIR}/logret/t/_delta_log/*.checkpoint.parquet');
----
true

# Every commit survives: v0..v5, all written seconds ago, against the default 30-day retention.
query I
SELECT count(*) FROM glob('${FABRICATOR_DELTA_WRITE_DIR}/logret/t/_delta_log/*.json');
----
6

query I
SELECT count(*) FROM lr.main.t;
----
5

statement ok
DETACH lr;

# ---- Slice 8: delta.constraints.* — a constrained table is INSERT-ONLY, and the INSERT is ENFORCED ----
#
# NEW BEHAVIOUR, arrived with the 2026-08-12 engineered-wood pin onto upstream (#136/#138/#139/#140), and
# gated here because it arrived SILENTLY — nothing on our side asked for it, so nothing on our side would
# notice it regressing. engineered-wood used to REFUSE EVERY write to a table declaring delta.constraints.*
# or delta.invariants ("which this writer cannot evaluate; write rejected"); it now parses and evaluates
# them. What that buys US is narrower than "such tables are writable", and the boundary is the point:
#
#     INSERT   works, and a violating row is refused by EVALUATION
#     UPDATE   REFUSED outright — even when the post-image would satisfy the constraint
#     DELETE   REFUSED outright — even though a delete has no post-image to check at all
#
# ⚠ THE MECHANISM IS NOT "our code checks constraints". `SupportsExternalDataFileCommit` reports false for a
# constrained table, which steers an INSERT off the streaming external-commit path onto engineered-wood's
# WriteAsync, where the rows exist to be checked. Our UPDATE/DELETE are COMPOSED from file-level staging
# APIs (StageDataFilesAsync / CommitDataFilesAsync) which are handed finished files and have no rows to
# check, so engineered-wood refuses them rather than commit unvalidated — the honest answer, and the safe
# direction. Lifting it needs either `constraintsEnforcedByCaller` (a claim we cannot honestly make today)
# or a public way to evaluate a table's constraints against batches we hold.
#
# ⚠ WE CANNOT CREATE A CHECK CONSTRAINT — `CREATE TABLE … CHECK (…)` is deliberately unsupported — so the
# declaration goes in the way DELTA ITSELF stores one: a `delta.constraints.<name>` property holding the SQL
# expression. That is exactly the shape a Spark-authored table arrives with, which is the case this serves.
#
# ⚠ MEASURED ON BOTH TABLE SHAPES, pinned on ONE: identical results with deletion vectors ON (the default,
# used here) and with `deletion_vectors false, column_mapping 'none'` — so the copy-on-write and
# merge-on-read DML paths are refused alike, and this is not a property of the DV configuration.
#
# ⚠ WHAT THIS DOES *NOT* ASSERT: which write path served the insert. That divergence is visible only in the
# Debug log (`delta stream-write … deferred` vs `delta write … mode=Append`). The parquet `created_by` does
# NOT discriminate — under native_write BOTH paths hand the file writing to DuckDB's COPY — which is worth
# stating because it looks like it would.

statement ok
ATTACH '${FABRICATOR_DELTA_WRITE_DIR}/ckcon' AS ck (TYPE fabricator, PROVIDER 'delta');

statement ok
CREATE TABLE ck.main.t AS SELECT i AS id FROM range(1, 6) t(i);

# POSITIVE CONTROL, and it is the load-bearing half: an IDENTICAL table with NO constraint, taking the
# IDENTICAL statements. Without it every refusal below would pass equally if negative ids had simply
# stopped being writable, or if UPDATE/DELETE had broken on this provider altogether.
statement ok
CREATE TABLE ck.main.free AS SELECT i AS id FROM range(1, 6) t(i);

statement ok
SELECT * FROM fabricator_delta_set_tblproperties('ck', 'main.t', '{"delta.constraints.pos":"id > 0"}');

# ⚠ FILTERED to the constraint key on purpose: this attach takes the DEFAULT feature set, so the table
# already declares deletion-vector / row-tracking / column-mapping properties beside it.
query II
SELECT property, value FROM fabricator_delta_tblproperties('ck', 'main.t')
WHERE property = 'delta.constraints.pos';
----
delta.constraints.pos	id > 0

# INSERT: a satisfying row lands.
statement ok
INSERT INTO ck.main.t VALUES (10);

query I
SELECT count(*) FROM ck.main.t;
----
6

# INSERT: a violating row is refused, and the message names the constraint AND its expression.
statement error
INSERT INTO ck.main.t VALUES (-5);
----
is violated by a row being written

# ⚠ THE REFUSAL MUST HAVE COMMITTED NOTHING — a rejected write that still landed its file would be worse
# than no enforcement at all, because the table would then hold a row every later reader trusts.
query II
SELECT count(*), count(*) FILTER (WHERE id < 0) FROM ck.main.t;
----
6	0

# The control takes the same row happily, so the refusal above is the CONSTRAINT talking.
statement ok
INSERT INTO ck.main.free VALUES (-5);

query I
SELECT count(*) FILTER (WHERE id < 0) FROM ck.main.free;
----
1

# UPDATE: refused, and NOT because the post-image is bad — this one is perfectly legal.
statement error
UPDATE ck.main.t SET id = 11 WHERE id = 10;
----
cannot evaluate it against the rows

query II
SELECT count(*) FILTER (WHERE id = 10), count(*) FILTER (WHERE id = 11) FROM ck.main.t;
----
1	0

# DELETE: refused too, though a delete has no post-image a constraint could be checked against.
statement error
DELETE FROM ck.main.t WHERE id = 1;
----
cannot evaluate it against the rows

query I
SELECT count(*) FROM ck.main.t;
----
6

# The control's UPDATE and DELETE both work, which is what makes the two refusals attributable.
statement ok
UPDATE ck.main.free SET id = 111 WHERE id = 1;

statement ok
DELETE FROM ck.main.free WHERE id = 2;

query II
SELECT count(*) FILTER (WHERE id = 111), count(*) FILTER (WHERE id = 2) FROM ck.main.free;
----
1	0

# ⚠ THE UNSET IS A REGRESSION GATE FOR A TRAP THIS WORK FOUND AND CLOSED: the declaration used to be a
# ONE-WAY DOOR. `set_tblproperties` commits through CommitDataFilesAsync with an EMPTY file list, and
# engineered-wood applies its constraint refusal to the CALL rather than to the rows — so a table declaring
# delta.constraints.* rejected EVERY property edit, including the one that would remove the constraint.
# MEASURED before the fix: this exact statement failed with "this write path cannot evaluate it against the
# rows", and the only escape from our side was DROP + re-create (CREATE OR REPLACE does NOT help — measured:
# it replaces the data and COPIES THE DECLARATION FORWARD). Fixed by passing constraintsEnforcedByCaller on
# the two metadata-only commits, where the claim is VACUOUSLY true because no rows are written.
#
# ⚠ The violating-INSERT refusal above is that fix's POSITIVE CONTROL, and it is why it sits earlier in this
# section: the property was declared through the very call that now asserts enforcement, so if the vacuous
# assertion had leaked into the row-writing paths, that INSERT would have been accepted.
statement ok
SELECT * FROM fabricator_delta_set_tblproperties('ck', 'main.t', '{"delta.constraints.pos":null}');

statement ok
UPDATE ck.main.t SET id = 11 WHERE id = 10;

statement ok
DELETE FROM ck.main.t WHERE id = 1;

statement ok
INSERT INTO ck.main.t VALUES (-5);

query III
SELECT count(*), count(*) FILTER (WHERE id = 11), count(*) FILTER (WHERE id < 0) FROM ck.main.t;
----
6	1	1

statement ok
DETACH ck;
